Username,Comment
@fellowgoodie,"I remember watching this match on DD live. After India won the match, DD telecasted the whole match again the following day (not the highlights, the whole match) and remember one-day cricket was 60 overs each, back then.
Also for those who say this was a fluke win, remember India defeated WI in the opening match  of this World cup as well, so they knew they were capable of doing it again."
@AbdulHadi-vv1ye,"I am from Pakistan but I am a huge fan of living legens like Kapil Dev, Imran Khan etc, this movie gave me goosebumps and Pakistan also came into world cup 92 as cornered tigers but Khan motivated his team to lift the WC, I wish Pakistan film industry should make a biopic of Khan as well. Love from Pakistan 🇵🇰"
-,"Wat a brilliant trailer, surely will create a history ️"
@anshikasingh5313,The trailer itself is so freaking emotional!!! Can't even imagine the scenario once the film releases ️
@dodavis4594,Those were the days we didn’t have television or online streaming to watch cricket….  The live commentary on the radio brought goosebumps to the core….  Blissful days!
@kanarakishan3186,This man deserves a biopic
@Delhiteonmission,This has to be the most iconic cricket film in bollywood ever ️️
@sushreedash2699,The trailer is just on time when everyone needs to feel that whatever might be the circumstances we should always stand together for our country. Such an amazing piece of work.
@YourboySudeep,Waiting for 24th dec to watch this legendary movie 
@sakshibhalerao7996,"It's not just a movie trailer, it's a inspiration"
-,Goosebumps
@sm_003,"Being a late 80s kid, I can definitely relate a lot about the vibe of that time around, winning the World Cup for the first time, live radio commentary, no TV, or only B&W TV in some rich people households, Been early waiting for this flick & its theatrical release for last one year & half. Am sure for me & many of us (late 80s & early 90s kids), this flick gonna be a revisit to our childhood memory lane, a time travel roller coaster journey."
@madmax5866,1:07 Jiva never disappoints  His comic timing will always be on point.
@eternalarts4411,I literally had goosbooms when india won world cup for the first  time proving to everyone  that we indian can succeed  in anything  even in movie it is vey emotional  hope i was born in that time  so proud वंदे  माथाराम
@punamborkar7036,And the Ranveer is coming in theatre to bring that memories of the world Cup of 1983 ️
@dipjoy_sen06,"One of the most versatile and dedicated actor is here again to prove his potentiality. 
#83 #Ranveer 
Another filmfare loading ️"
@prabhatkumar4491,I have watched this trailer more than 100 times and can also watch 100 more times. It gives so  satisfaction and feels proud that I can't wait for the movie. I was not born in 1983 but truly speaking I lived those days after watching this. 
@aryanraj-cx7rn,When you see 83million views 
@nikhilsaurabh378,"Kapil Dev is such an underrated player... But after this movie we all will know his legacy ..
Let's make this movie to collect atleast 183 crore at box office "
@miruzairyousuf5182,I wasn't expecting this.... This is another level.... Just Wow.. No words....
@funkymitra5899,expression at 3:06 is just awesome and filled with determination.... Ranveer just proved again he is superstar
@rakeshnagarji1072,"35 Saal pehle humlog azadi Jeete the🇮🇳🇮🇳🇮🇳
Izzat jitna abhi baaki hai"
@rK-fw5ov,"Goosebumps Trailer, Really Hats of Directors and cast crew"
@muhammadnoman06,"This is such a great trailer, all seems natural, great acting by RS,  I'm a Pakistani, but I got the goosebumps also. Looking forward to watch the movie."
@adeetya_0810,"Each Second,Each scene and Each Word Gives Goosebumps.
 This Movie Will Beyond Our Imagination.
Thank You All 83 Team."
@nafisatabassum344,"This movie released in wrong time..
Such a tremendous movie by Kabir Khan"
@imagedreamz,A soulful respect again to the legend #kapildev Sir
@manjunathnaik4705,"This trailer just gave me goosebumps ,this is a type of movie  in which u know the climax before it's release but still would love to watch at any cost ..."
@meetbediproductions6962,The way rv portraying kd is just mesmerizing and kinda looks like he's become kd and not just acting like him...
@nehanaruka6557,"What a Movie!!! Man ......
Wins heart ..... Amazing ️"
@AbhijeetSingh-rx9ef,This movie is gonna give a chance to experience that historic win to anyone who wasn't lucky enough to live it before!
@arohibhuvana,"Ranveer 
Wt not u can do man ️
What a performance felt like Kapil Dev sir went back to 83 and lived this again ️"
@reazalam5902,What a sensational trailer.... This is a big screen movie ....feeling proud and emotional at the same time.... Ecstatic to see first world cup win by India..... It's surely going to break all box office records.... 
@devmishra2160,3:00 our great Sachin Tendulkar ️️️️
@IzanaAnime,Literally This trailer is giving everyone goosebumps . I'm also excited  .
@sriharis6706,"Feeling those chills.....I was born in 2004, got to know about this historic etched-on-the-wall moment, and I still remember this, whenever I see Cheeka's channel. As he says, there can be no one matching the guile of Kapil, according to me....and Ranveer and Jiiva melt my heart's with their pinpoint acting like Paaji and Cheeka! Looking forward to this must-see movie...more thrill, more Josh, more goosebumps, more emotions overload! All the best to Kabir Khan and the actors who have played the important players of this '83 WC!"
@pankajgupta594,This movie connect the Indian by an emotion. While watching the trailer it gave me goosbumps and made me emotional and made me realise that from where Indian cricket has grown from dust to gold. I could bet this is going to the best cricketing thriller of all time even bigger than MSD biopic.
@bhuvankt4978,Cant believe people preferred pushpa over this masterpiece
-,मैं इस फिल्म को सिनेमाघरों में देखने के लिए उत्सुक हूं।
@kunalsingh9116,"The feeling is strong that I am coming again and again to watch this trailer, the legendary story of 83 world cup that we all have heard this movie will make every generation feel what every Indian felt in 1983 ️."
@jeevaningale1712,This will be the first movie I'll watch in Theater after pandemic  1983! The  defining year in India Cricket as a religion!🇮🇳 Trailer looks awesome!
@adityadanani970,Congratulations for 1 year of 83
-,"Abhi maja ayega na bhidu.. Arijit ka woh purana time wapas aagaya, Back to Back songs in blockbuster movies.. Jubin ka tarah Remake nahi  Super Excited"
-,It’s a masterpiece ! A super hit for sure.
@nayanjain4135,"Never expected this from Ranveer Singh , what a great trailer, Every second gave me the goosebumps. Simply, I loved it!"
@drrifatalam7413,Did anyone notice that Mr Kabir Khan showed Sachin Tendulkar too ? And his Brother as well ? What a direction!!! And what a performance by Ranvir Singh !!!!
@Dk-rt3rz,"I never watch cricket but somehow this trailer made me tear up like crazy. Was not expecting such emotions watching a trailer. I was totally skeptical about it since the movie got announced, everything looks very promising"
@tejassharma4171,Everybody is talented because everybody who is human has something to express like Ranveer Singh️
@Kunchurofficial,I would like to Thank you all cast & crew. This is not just a movie...its an emotion for all indian cricket lovers and who were not born at that time. I was getting goosebumps while wtching this movie
@srirams1988,"One of the best movie... Right from the teaser, trailer, promotions n finally movie... Top notch...."
@TheMeeTime,"No matter how many Cricket centric movies we get, But we still enjoy every moment of them, Cricket is in our Blood  
Jeetega Bhai Jeetega India 🇮🇳🇮🇳 Jeetega "
@bapunirocks,I literally started crying out 2:54 ...still feeling goosebumps after watching out trailer....
@vinayakrao1167,Can already see this film becoming a super hit. Goosebumps throughout while watching the trailer. Jai Hind
@googgleyy,"I wanted this motivation after we played our best but lost.. love you always team India
🇮🇳🇮🇳🇮🇳"
@SeerealCreationsKannada,2:13 Goosebumps This is lit..  a blockbuster 
@honestreview6900,"Trailer says it all.
It's block buster.
Shows how hard everyone would have worked for it.
Desperately looking forward to watch this movie....."
@mr.abbyyt2229,"This has sent shiver down my spines. If the trailer is so good, the move is definately going to be a blockbuster!
Kudos to all the cast and team!"
@karthiksharma331,"Fantabulous movie....how can this movie be flop??....Pack of emotions. 

Masterpiece!!!

The review critics were big chutiyaas...."
@jitendrarout5486,A heartwarming and mind-blowing trailer. Lots of love and respect for 1983 world cup winning team ️🇮🇳
@gheemail,"No matter how many times you watch it, tears flow automatically in the last part. Thank you for making this movie, so that we can re-live and celebrate the most historic moment in Indian Cricket. Salute to Kaps and the team! And a great work by Kabir Khan to have the audacity of trying to recreate this piece of history into a masterpiece. Must watch in the theatres - which I guess will be no less than a stadium experience."
@atharvxd3957,i got tears watching this trailer how indian cricket is changed through years we have such a diamond playing for our team proud to be a indian
@rupkotharriya4191,"What a wonderful film...aysi film sadeyo may1bar hi banti hay...just amezing....india...india ...🇮🇳🇮🇳🇮🇳
Kapil ...Kapil...."
@priyankabharti2080,This is gonna be a masterpiece..we will celebrate our legendary victory once again with this movie.superb️
@its_khanaamir,I'm So Addicted To Watching This Trailer Again & Again On Repeated Mode  Because Seriously It's Amazing & Pure Masterpiece !
@rehmaanfatahu1272,Fantastic trailer..  This will be another gem of Bollywood and another best performance of Ranveer Singh.  He nailed it in every role with ease and dedication. Can't wait to see this movie ️
@kavitamaurya617,No matter how many times i watch this movie everytime it gives me a tear of joy and goosebumps. What a commendable match it was! Splendid! Amazing team and strong captain who stood strongly. A match which gave hope of winning to team india. Cricket is not only game but also emotions.  Thanks to director for making this amazing winning match of india🇮🇳  I was born after decade but I can still feel that joy of winning🇮🇳
@annapoornadevaraj219,Yes.. i watched the movie . Just feel proud about way the movie has been picturized. I just don't find words to express what I felt while watching the movie.. It is the celebration of 83 world cup.. Hats off to the Kapil Dev Sir and his team. He in deed earned respect for our country in that crucial time. Ranveer Singh one man army.. after this if I think about Kapil Dev Sir I get Ranveer's face in my mind.. what an actor!! Every single actor has given complete justice to their roles.. efforts made by the whole team is just incredible.. ️️
@amirakhan5794,The trailer gave me goosebumps. Too much excited for the movie and once again Arijit killing with his voice. So excited to hear it out ️️
@ankitpattnaik2580,"Can't wait to witness the historic win of our india.
Only heard stories from elders and read about it, 24th dec come soon."
@TanishkRawat-f2j,Movie name is 83 and trailor got '83' millions views 
@prabhat30100,"Everyday I watch this trailer, goosebumps every time ️"
@akshaygala121,I am excited to see this movie as i am a huge cricket fan and have only heard about this day and have never witnessed it…Sir Kapil dev️
@ranjana9895,"Goosebumps And Emotions In Just Few Minutes Can't Wait To See The Movie It Is Going To Be Blockbuster 
️️"
@nishantraizaday1368,"Goosebumps and tears! If you love cricket, this trailer will move you"
@jyotijuyaldhoundiyal9261,Full of emotions best blockbuster trailer ...this film is something out of the world...   kapil or ranveer hats off
@HashtagGamerr,"Always wanted to live the 83's cricket era, looks like this film is going to complete my dream  #GOOSEBUMPS ️ What are you Ranveer Singh "
@mr.farrenheit7091,Even I feel the enthusiasm and nostalgia as a pakistani passionate cricket lover as my favourite crickiter is sachin tendulkar and I’ve seen some glimpse of kapil dev too to me this trailer is really inspiring and I look forward to watch this movie and want to share ny thoughts with my fellow beloved indian brothers and also want go hear their experience and goosebumps while watching this movie cant wait ️
@adityadanani970,Congratulations for 2 years of 83
@abhiyanshurao154,"This is going to be the best film made on Cricket and Team India... Absolutely magnificent ️
Mega blockbuster hit and Ranveer Singh is mind-blowing in Kapil Paji's role, I'm in love with this trailer."
@aayushjainsethia4191,"Goosebumps throughout the trailer.
Brilliant story with a brilliant cast, best of luck guys ️"
@jeetnag4716,A movie worth watching... Specially for the sports lover a movie to remember. Wonderful acting by Ranveer Singh.. A gem of a movie ️️️
@artificiallygreenlight598,Thank u india 🇮🇳 FOR WINING THIS CUP without u we would never did it and without Kapil ur amazing captain 
@yadhulsuresh,this is gonna be a legendary movie.. perfect casting and kudos to the whole team... looking forward for the release ️
-,Goosbumps. Faad Trailer.
-,தரம் 
@mohankumarmurugesan,"Watched this movie last weekend! Kapil Dev's determination brought a world cup and changed the fate of criket in India and the cricket game itself! Brought 100 billion fans into the game, which brought sponsors, investors, advertisements! Then stars like Sachin, Dhoni, Kholi all started with one man's dream to win the world cup and bring pride for the nation!"
@20shourya,"this looks like it'll be a fairly accurate depiction of the emotions, the circumstances, as well as of the cricket! The accuracy in the shots and the iconic moments is a rarirty - I really like how they included that bit with Madan Lal celebrating Viv's wicket with his hands pumping - a 1:1 match really!"
@Off_Virat_kohli_18,I respect everyone who were involved in this. Seriously the best piece that I've ever seen on YouTube. HATS OFF TO YOU ALL!!!
-,Fantastic trailer ️
@zarnainbilal.6,Why Floop this movie I cant Believe such a amazing documentary love from Islamabad Pakistan 🇵🇰 
@navis6709,"Watched it yesterday.  One of best movie. Love India, love Kapil love Ammy virk"
@Sid_Ro_45fangirl,Goosebumps 🇮🇳 celebrating the victory of indian cricket ...this is the most beautiful way to do ...wow with this one more Ranveer have proved that he is meant for doing any kind of character on screen...hats off to him for he has got everything possible for being kapil dev onscreen 
@johoapkopasandbycmsharma6057,"Me ranveer singh ka fan ho gya hu aur uun sabhi actors ka bhi jo isme the 

Mujhe apne sabhi Mahan khiladiyon pe garv h I love all"
@priyadarsini5132,We will not frogot this legends  inda 1 world cup 
@prishhspamzz,"No matter what people say this was masterpiece, is masterpiece and will be masterpiece"
@tauqeerwaqas,Kapil Gavasker Sachin Kohli Dhoni these are not only great Indian players they are ambassadors of this game I never heard any negative things from them.  Respect from Pak.
@TanishBatla,This movie deserves an Oscar 
@munnivodro3030,India is the first team who beat West indes and won their First world cup title. Love from Bangladesh.🇧🇩🇧🇩🇧🇩🇧🇩🇧🇩🇧🇩🇧🇩🇧🇩🇧🇩🇧🇩️️️️️️️️️️️🇮🇳🇮🇳🇮🇳🇮🇳🇮🇳🇮🇳🇮🇳🇮🇳🇮🇳🇮🇳🇮🇳
@robloxplayer2258,"What a fantastic movie.
Very nostalgic. Love from Pakistan"
@OKPtradeexim2759,Ranveer doing well his job well done
@techbaalak,Meri Favorite Movie All Time ️
@Avesh_Agwan,Ye Ek Matr Esi Movie hai India ki Jo flop he collection me but jisne y movie dekhi hai uske liye ye movie All time blockbuster hai 🇮🇳🇮🇳🇮🇳ye movie flop hokr bhi hit he
@likeablelabradoodle4035,"Back when every single match could brings the whole country together, a single match to captivate every pair of eyes and ears, back when cricket was and emotion"
@firestatusnt,nice
@protubershrish6765,What a dialogue by Srikanth — to the journalist 
@prateetsrivastava310,Emotions of 140 crores ️
@Bruce-ts,Watching the movie now. Within a few minutes I can say this shouldn’t have been a Bollywood movie.
@anishapurohit1703,"After this movie I'm  big fan of ranveer Singh  what a actor  ,what a movie and what a director ""kabir khan ""just wooooooooooooooow . Faisa vasul movie h "
@mmkw202,83 is the best film of Ranveer Singh's career..
@shivendradixit7168,Is moovie me kisi ne apne liye kaam ny kiya but they represented how every indian can easily proud of india
@khizar_junaid,Can't believe this masterpiece was declared a flop 
@pawineecheewapak4933,love the most..love every scene..love everything...One of the best movie ever.Big fan from Thailand
@Takemichi053,Wow 83 movie trailer mai 83 million views 
@moong2649,This movie should have earned 1000 crores
@geetachakraborty263,After seeing the trailer got my goosebumps 
@chandrikachandrasekharan9025,No one else could have played Kaps better than Ranveer.
@raunakyadav3648,"Match khatm, world cup khtam, captain khatm 
Miss you king kohli ️"
@rakibulmallick8318,Finally a movie together where none of them die in the climax
@subhashyadav-iq4vq,"Wowww It's Amazing,
Film Name :- 83
And Trailer views also 83 million in this time "
@soumikpaulthebeast,"I don't need any motivational video after 83. Anything is possible if you think positive. Simple. That's what I learn. Everything depends on your mentality, your thinking "
@renukaharlalka2592,"Thank u so much Kabir sir fr making ds movie... Mujhe nahi pata ki boxoffice collection ka iss movie se kya connection hai... Mere liye ye ek emotion hai... This is an event which I had only heard about... But coz of u I was able to see it, to feel that emotion which I hav seen my father boasting while describing it.... N not only fr me but for every cricket fan who wanted to see this event unfolding or d 1s who saw it earlier... This movie is something which should not b judged on its boxoffice collection... Judge it on wat a cricket fan felt while watching it.
️ for cricket
P.S. also a big big thank u fr d editing team... D way old clips of 1983 world cup are edited in it is marvellous...."
@Kaatt_avaraathi-wg1sz7fg2e,The game that United the nation  Jai Hind 🇮🇳
@AnotherAwakenedHindu,"Watching in 2023
Still getting goosebumps 


Bollywood is in this condition,
Because the Audience rightfully deserves it"
@santoshkadkol,"This is a right time to re-release 83 movie in theatres... With LSC and Rakshabandhan not doing well , its a good opportunity to get this movie back in theatres in light of independence day spirit"
@somabiswas8650,Too good film... Film made us Nostalgic... Wow raat... How can we forget... Midnight celebration... Next day... Sirf cricket e cricket... Mouth watering dises for Lunch... Anandabazar patrika porna ka dhoom... Woh line.... Modon er roshe bhosso... Aaj bhi yaad hain... Rosogolla distribution... Okal diwali... Kya kya nahi hui jitne ke khushi mein.... Thanks Bollywood...
@tragain3404,"What a master piece ️
Love from Pakistan"
@THE_IBRAH1M,I don't know why but every time i see this trailer kushi se rona aa jata hy 🥹 And by the way i am a Pakistani 
@goodlife2714,"Kapil Dev
Sunil Gavaskar
Sachin Tendulkar
Virat Kohli
MS Dhoni

Are legends of Indian cricket"
@fariahoque592,Super awesome movie. Ranveer Singh your are the best and you proved it again. All the characters played marvelously. One of the best movie of Bollywood. This movie deserve more
@Nikhilthamke768,"Such a mind-blowing, inspiring movie , but why  don't know people not watched in thetare this movie "
@jatinuikey7436,"What a movie  ,,, as I was born in 1999 , i have very less idea of what Kapil Dev mean to India during that time , but this movie made  me learn the imp of 1983 match . 



Movie is really awesome "
@shouryaroy5934,Re release in theatres 
@prof.imranghabrani2594,Great movie to watch. One of my favourite movies.  We proved that we are not a team to be taken for granted. Salute to team 83
@SriKanth-zp5im,We need a team and passion like this in today's age. India's loss against England in 2022 T20 Semis is hurting
@muhammadsharif1205,"One day i saw a youtube video comparing ms dhoni untold story and 83 and i thought man ,just because sushant is dead doesn't mean 83 is a disaster they both are good in There own ways ,so please stop comparing"
@Cgrace-777,This is a masterpiece… one of the best favorite sport movie of all time..
@SagarkumarNagesh,Cricket in fevret love this film
@ankurmodi8807,"I have watched movie last week. The one thing is best and it is about Ranveer Singh. 
Till now, I havn't figuring out is it  ranveer or kapil dev. His acting is awesome"
@Ghostrider-ul7xn,"""Just that we may have gained our independence 35 years ago, but we haven't yet won respect, Captain""

That line really got to me. Its still true even today."
@imagenationstudio1095,Its one of the most emotional moment of indian cricket team and for India.. Unfortunately the boycott gang make this masterpiece flop.
@jayendragajjar6654,"""This looks intense! Can’t wait to watch it. Hope it lives up to the hype!"""
@tushardutta1924,Masterpiece recreated 
@rageguyyyaa,it is a shame that a movie like this underperformed at the box office and the audience went to watch fu**ing pushpa instead
@Cgrace-777,This movie deserve an international award
@dhruvpathak907,The part that touched me was..... Aazadi humko 35 saal pehlay mil gayi thee.... Izzat milni abhi baki hai.
@pixxelstudio5670,Isse juada khushi to mujhe ms dhoni movie me hui thi ️ love u shushant
@AnilSolanky-xf4pg,Ranveer Kapoor pe sir kapil dev ka roll best Kiya hai lag bhi aise rahe jesi Kapil sir khel rahe ho cricket ke itas has tha jo kapil paji ne kiya love you kapil dev sir
@svrssaikrishna5275,Kapil Dev the Haryana Hurricane 
@manas6373,"Dont think ever in the history of cricket has a single six awoken not just the dressing room, but an entire nation."
@shiddat2021,This film deserved so much more ...
@hamdankhan8874,2:31 part was amazing
@mgopatir,Goosebumps after watching the movie literally goosebumps 🫡
@devilyo-yo3672,Great scene above cricket.....
@kevalchauhan2957,Congratulations for  '83M' views on your trailer of movie '83'
@kumarashutosh710,Hahahaha its a good line AARAM SE MAAR NA CHAKKA
@ANKITASINGH96_97,What a coincidence yrr 83 million views 
@paritoshbehera9825,The 1983 World Cup win doesn't just get us the first World Cup. It gives us the greatest batsman in the world. - SACHIN TENDULKAR
@mariamathew4913,Ranveer as Kapil dev
@kaligupta2749,"This is how a biopic is made, by RECREATING the same scenario, not by replacing MSD's face with SSR's face"
@nushratfatima786,While watching this movie tears automatically dropped off seriously headsoff to Kapil sir thank you for that victory for India...
@RoseRose_2022,Amazing movie.. Proud moments of India.. 
@cuteboymasti3148,Just watched movie....  It's bundles of emotions..  It's bunch of entertainment...  Fantastic direction by kabir Khan..... Ranveer no words.... This movie flop due to Corona Pandemic....  I honestly give 10/10....
@kdking214,Supperb........
@vinodguptamummidisetti7702,"What a film, tribute to the  team. Thanks for making this film"
@tamilazhagan1918,This is Best of best ever 
@mamtagupta2054,Ranveer portraying kapil sir is superb
@abdullahshamim4977,that shows how much power india have.Love India.India stays in my heart love you.
@ayushmahajan7307,God level direction ..but sad to see how people treated this masterpiece...
@muhammadraheelkhan7208,"I have watched this movie just halfway and is in awe of how greatly it was written, directed and acted and I figured it out that its almost based on true events then what a triumph it was for India in 1983. Truly respected and appreciated Kapil Devils. Respect from Pakistan"
@kn461,"The next time India wins a World Cup trophy or event this film will do well then, 

But personally I know it didn’t perform well in the box office, but I did really enjoy this film, it might not have been perfect, but it was still a very nice film and very patriotic and proud of India film"
@sreejithaemgnregamanamboor4938,"Awesome, sportz movie, proud to be an indian, cricket fan "
@moviewisdom5595,"Just watched on Netflix, wow what an experience to watch this movie. Even though I know India won this match, I was still worrying. Felt like watching the live match. Especially the final match. Just because of some stupid people I think it didn't do well in box office."
@EndurerAQ,"Viv Richards trained against toughest bowlers which were the ones in his team, maybe the reason why he played so good against other teams, if at that time there were leagues then would have been fair game for all players "
@Anujsharma-zw3zj,Roots of indian cricket
@Devang955,I saw this movie in theaters and then many times at home. It was an outstanding movie which deserved more box office numbers
@piya-mia,Goosebumps. A celebration of togetherness
@flame1674,And again we're in the finalss
@Dreamtraveller-6262,Best movie for cricket legends 
@HarshSingh-bg8xw,"What an amazing movie! Just loved it. It was like experiencing the 1983 world cup in front of my eyes. It's a goldmine for cricket fans. 
Brilliant performance from all the actors. Movie doesn't just revolves around Kapil Dev, it gives every character a chance to shine."
