Username,Comment
@jeswinraju1547,Disappointed by how people treated this movie in theatres. This is a masterpiece which left me in tears. Cricket is one thing in India that people celebrate irrespective of religion and caste.
@TOP10STAR,i was not even born in 1983 but thanks to bringing those world cup memory again. This is the story of India's first Hero KAPIL DEV 
@srinivasnahak3473,"The best part about the trailer is ""It doesn't just revolve around Ranveer Singh.."" it has also given importance to other characters..which is truly commendable "
-,Ranveer has played his Role has captain Kapil Dev marvellously. What an amazing movie “83” we can only imagine the atmosphere and how India felt when wining the world championships ️
-,Ranveer during the interview scene definitely felt like Kapil Dev  . Great casting. Another Kabir Khan Mega blockbuster ️
@prakhart92,"A lesser known fact :
Mohindar Amarnath was man of the match in both Semi-finals and finals.

So excited to watch this.🇮🇳"
@bharathhegde9931,My dad said 83 world cup was special to a whole Indian nation... I saw a proud  happiness in his eyes when he use to speak about it... Sad my dad is not there to see this movie now... After seeing this trailer I got goosebumps looks fantastic looks so realistic.. Hats off to ranveer singh
@nishiali3007,"Just saw this movie.....it's commendable 
Best part is, it doesn't revolves around just one person/ player, it shows u the journey and struggle of whole Indian team."
@rockstarabhi9971,As a cricket fan We all have to accept the fact that Kapil Dev's 175 runs was one of the best odi innings of all time ️️
@psuraj7116,"u may not like ranveer for his life style, but trust me when its about playing character roles.. he is simply the best in this industry, he may not dress right, he may be a nuisance but when he plays character roles. he is the boss.. absolute goosebumps felt"
@samrikasinha5926,"After MS DHONI-the untold story, this is another enthralling biopic masterpiece!! Loved it."
@unknownperson9247,Some movies can't be judge by their box office collection. This is one of them.
@Batman-mf6ud,The transformation and make-up of Ranveer as Kapil Dev is UNBELIEVABLE ....This is the real tribute to the players of '83.
@sumitojha9082,"2:35
""I say before, we are here to win""
Exactly like the legend Kapil Dev.
INCREDIBLE"
-,Took 38 years to know the story about the legends of 83. Goosebumps  Can’t wait for this masterpiece. Fun fact - 38 is the reverse of 83 
@eshwarajith7877,"a shame that this movie flopped box office. such aa heart touching movie and conveys so much on never ever give up. respect to kabir khan, kapil dev and all the other actors. totally loved this film."
@ronjon4245,when Ranveer says we here to win... and what else we here for... his dialogue delivery appearance look exactly like Kapil Paji... what an actor he is️
@rahulbose2334,"No matter what,whenever Ranveer acts on any character he not only gives his 100%, but I would say 300%.Thats his style.Copying a legend like Kapil Dev Sir is not a joke ,and he has done that truly from his heart.Hats of to the entire team and Kabir Khan to bring those memories back..."
@kunalupreti7621,"no matter how ranveer acts irl, on screen his skills are unmatched, hats off bro"
@michaelmiklosofficial,What a masterpiece so glad to be part of it
@yudishcallee7579,"The dedication of Ranveer Singh towards his craft is outstanding and so inspiring! We all know how crazy he is in real life but when it comes to his work, he will put his life into his character and this is what reflects on the screen everytime.

I felt his best performance was Peshwa Bajirao ..but he came as Alauddin Khilji. Just when you thought Khilji is his best, he comes as Murad. Just when you thought that was maybe his career best, he comes as Kapil Dev. I can't believe this guy was Bittoo Sharma some 10 years ago. What a career graph. What versatility! What an artist. Hats off."
@avinashshivaram4457,Huge respect to Kapil Dev sir and to the entire team. Seeing this trailer i felt leading a team in 83 world cup is much much bigger achievement than leading the team today.
@sahinalam4252,"Finally a movie together , where none of them die in the climax ️"
@shreerangvr,Saw this film on Netflix.  1 time watch..good film...1983 one day worldcup Ranvir did good role of kapil...India
@najibkhan1426,"I’m from Afghanistan 🇦🇫 but this trailer gave  me goosebumps.
Lots of love from Afghanistan to beautiful India 🇮🇳"
@user-he2ki8gl2d,"My dad till date talks about this match, our generation wasn't lucky to witness the live match though but for him and his generation this movie is going to get some real good memories back."
@shailjasaraogi6213,"Looks like Kapil Dev is acting for himself.
Kudos to Ranveer Singh's acting! ️"
@tanbir7372,"Critics says it's a Flop Movie.. But I swear really it's great movie.
Must watch this for every Indian.."
@raghavendrarao4060,1983 may be number for others but it's an emotion for every indian...
@ichigokurosaki7699,"""I say before, we here to win""

GOOSEBUMPS guaranteed."
@aiman5841,Jeeva as Kris Srikanth is the best Casting Ever. He Nailed It. ️
@dnpandeyji,Coincidence is that 83 movie got 83 million views 
@praveen131994,"Dangal was the last movie while watching whose trailer, I had goosebumps...

5 years hence.... 83 gave the same goosebumps...
Definitely a theater worthy movie... Every actor is in their best avatars..."
@garimaarora8579,"Ranveer Singh's acting in the film shows that never judge a book by it's cover...no matter how he dresses but when he comes on screen, he proves that HE IS THE BEST IN WHAT HE DOES"
@jainishpatel1304,I had goosebumps after listening to this line “ no matter whats’s going on in our lives when we walk onto the pitch in our uniforms we have only one purpose to play for our country with all our hearts “ this is not just a line it’s an emotion !!
@kangkanab8844,"Saqib as Mohinder Amarnath really did justice to the role!!! The Man of the Match both in Semis and the Finals. Ranveer as Kapil Dev, Tahin as Sunil Gavaskar, Jiiva as Srikkanth!!!! The entire cast did a spectacular job. This movie will be played for generations to come!"
@azaholmes4930,"Dude the way Ranveer was speaking was so so similar to kapil dev's, chills literal CHILLS!!!!!!"
@omkargaikwad2739,Goosebumps..tears in eyes ...MSD was a player oriented movie but 83 i think will be a team oriented movie... will be great movie for all those people who were not born in 1983... the real cricket  this movie will be a tribute to all the legends of indian cricket
@praveenbabu149,Mark my words.. nobody will leave from theater without tears of joy in their eyes…a great tribute to our great Kapil Dev and his warriors..love from Kerala ️️️️
@moumitasaha6538,I was born in Nov 1983. Just few months after the world cup. Today I  saw this movie. It is a masterpiece. I was not watching a movie. Its seems to be I am watching the world cup. Enjoying every moment of it. My father was very much fond of cricket. I wish if he was here today. He could have revive his 83 moment once again. In every scene I missed my father.
@Deybungshu,"The dialogue deliveries... Damn... Bollywood can produce gems... Ranveer Singh is a proof... 83 team... Damn good performance... Love Pankaj, Hardy, Amy, Banti"
@mamathacnjain,"This man Ranveer Singh 

In real life his personality looks fun and crazy ... but his seriousness towards his work was commendable.. the way he chooses every script with 100% passion.. 
Tremendous artist we have in our country literally proud of him 

Deepika padukone mam Her grace "
@sanyakalra6376,Ranveer Singh is here to prove again that he is just here to win..what an incredible actor
@kratos692,Unpopular opinion but one of my favorite scene is when Boman Irani who was playing the Indian commentator moved to tears. It cut after only a few seconds but was very powerful.
@DillonPink,Goosebumps. Ranveer is such a talent. He's got Kapil's accent and mannerisms spot on. Blockbuster and record breaker on the way.
@ahadhussain557,"I don't know why but I got emotional after seeing this, anyone else?.... this one's definitely gonna break some good records."
@spartanroxofficial9261,"The voice from Kapil Paji ""I say before, we are here to win"" is just wow"
@seramemoitsheki,South Africa approves . What a great movie 
@firefalcon8178,"Everyone is shocked by the makeover of ranvir singh , totally unexpected.
Outstanding acting and ranvir singh career best performance could be in this movie"
-,"Born in 90s, heard a lot studied a lot but this film going to give a chance to live the victory superb "
@phoenixgamer5005,"This is not an Kollywood or bollywood , tollywood cine....THIS IS INDIAN UNITED FILM...️️"
@jehanmi,I am a Sri Lankan who at the age of 18 years old had the chance of meeting the great Kapil Dev in Colombo Sri Lanka. This movie was a testament to his humble character. I am so sad that I didn’t know it was released in theaters.
@maggumagar,"1. They actually selected punjabi actors for punjabi players.
2. Ranvir Singh imitation of Kapil Dev was actually superb. Eyes n teeth
3. We wanna see the ending, when the spectators will run to the ground and Kapil will lift the WC!"
@bhramar3550,The way Ranveer has mimicked Kapil Dev's style of speaking is truly incredible..can't wait to watch this masterpiece🇮🇳🇮🇳
@Robin.J_03,"Why indian films give me so much energy and goosebumps?? I don't know why i am feeling about my own country and history by seeing every patriotic movies of india. Not only patriotic  but also social awareness, social problem types movies as well.  England divided us in different countries  but these movies make us united again. 
 I am from Bangladesh 🇧🇩.  I always admirers India. 
 
জয় বাংলা. জয় বাংলাদেশ. 🇧🇩"
@aditiamonkar6389,"This movie deserved to be a blockbuster in the box office!! 
Such a well-made film. Not one dull moment!!"
@abhimanyurajaura4493,"This man deserves a biopic..  He has produced numerous single handed match winning batting, bowling & fielding performances. The biggest cricket icon of India."
@onkar2749-u6b,"It gives goosebumps when kapil dev says

""I Say Before, WE HERE TO WIN""

Ranvir Singh has nailed it....!"
@gauravgupta2575,Ranveer singhs entry…expression.. impression…delivery…on point…what an actor
@urbankoto,"Compare this movie with today's films, this paid a proper tribute to the 83 indian cricket team and brought the emotions alive. 

All characters acted so well.  Ranveer. Hope you make a comeback again with such a meaningful movie."
@kamalesh2123,"Man it's Goosebumps to see Jeeva as Cheeka! Kapil: He doesn't know how to defence!!
Pure hitter of the ball Kris Srikanth"
@adityakmit4625,Being a 90's kid heard and studied how our team won the match. It's now time to witness the nail-biting match with so many emotions 
@David-ws1ct,Im not a RANVEER FAN.... but I must say he literally KILLED IT in the character  of KAPIL DEV JI.... HATS OFF..... 🇮🇳🇮🇳🇮🇳
@nxg1265,Just finished watching it and i must say it's one of the best sports-based movie. I've always doubted ranveer's acting skills but he's proved me wrong in this movie. The movie doesn't only show Kapil's accomplishment but also the skills of the other players and let alone the indian players skills but also the opponent's. The way the indians were  reunited by the game and thier expression of joy was 10/10. TOO GOOD
@ssagar8808,"Srikanth saying- ""Aye kya paagal ho gya h re hamara captain"" 
That was awesome. Same talking style . Srikanth himself has told this story in many interviews. 
Jiva as Srikanth would be the best to watch in the movie.Srikanth is hilarious."
@sreeragjayaprakash1206,"By seeing Jeeva's acting as Cheeka, one thing is sure. Each and every expressions and every mannerisms of other actors are near perfect. Kudos"
@bekindandpolite2158,One thing i like about these kinds of bollywood movies is how people of all states and religions are represented and makes us more united when some  political parties try to divide hats off kabir khan for this movie
@AryanPaaji,0:30 Ranveer Singh  with Kapil Paaji's accent 
@nikhilmane701,"He may got trolled for his dressing
But when it comes to acting he nailed it"
@VickyVk1,Jeeva doing the role of Chika (Srikanth sir) is really on point especially his voice modulation  its gonna b fun
@rishabhmishra382,Ranveer has established himself as one of the most class apart actors and the way he enters a role and enters a personality seems like he is living that person. Amazing movie amazing cast. Looking forward to this amazing movie
@rohitgiro8202,83 movie name 83 million views 
@GurmeetSingh-fw2zi,"Goosebumps.

Do u know 

1. Kapil Paaji just have 1 ODI century ( unbeaten 175) in his entire carrier and that came in World Cup 1983 itself.

2. The maximum over on those days were 60 overs.

Now the magic of 83

1. India won the world cup in 1983
2. India all out in final at 183
3. Highest score of Saurav Ganguly in ODI is 183
4. Highest score of M.S. Dhoni in ODI is 183
5. Highest score of Virat Kohli in ODI is 183."
@tousifakram5564,"Now I realize why my grandparent is addicted to cricket.
My grandparent says, 83 moment was glorious even on Radio."
@thilinienagasena1163,not even born in that period but getting goosebumps by watching this trailer! what a masterpiece 
@tapanpattani5394,Had met Kabir Khan in a press abwo and was feeling so sad that this masterpiece people could not understand  he said tapan kya kar sakte hai ! I said sir it's too sad 
@dhavalvaghela714,The actor playing Shrikant just nailed in that 2 second scene in this trailer... tremendous job.
@tusharkalol,Every time people troll for his funny outwear or clothes but in the screen he has been always gives you goosebumps by marvelous performance and this time also he proves that 
@amanbhatia211,"Pure Goosebumps! India's win in 1983 is special for all Indians but extra special for me as India won the world cup on 25th June 1983 couple of hours before my birth (it was early morning of 26th June here in India). I have grown up hearing family talk about how India celebrated my birth :)

And now the movie 83 is releasing on my wedding Anniversary - 24 December! What a treat!"
@lovelymaahi,"We lose the final today me and my dad was so upset after that.then i  download this movie and said to my dad ""watch this"". after end of this movie i seen first time in life my dad's eyes was full of tears... thanks to all people who makes this masterpiece"
@PikachuFanRishabh,"""35 saal pehle humne Independence to jeeti lekin izzat abhi jeetne baaki hai"" line broke my heart .
It's true that respect isn't given/taken/begged, it's earned 🇮🇳."
@burntwheels7106,Can't imagine how this would have felt back in 1983. Just had goosebumps watching the trailer. What a feeling .
@neerusharma7599,Ranveer Singh is such a chameleon. GIRGIT what we say in hindi...He gets into the character skin just so perfectly....he leaves you impressed with his performance even if you are not his Fan.
@szigetvar1,This is one of the best movies I’ve ever seen. I was 10 years old when India won the World Cup and I remember having tears of joy. Every time I watch this movie I have tears. I feel so privileged that I could see these great players play their magical game.
@maheshsajjan8841,"Born in the 90's , just heard the stories, but I can experience those moments now.It's been 38 years since the 83 WC. Even those numbers are exciting when u see. Man!!! This is gonna be wild to watch in theaters."
@15ritikakrishnan68,"'What else we hear for',  the way ranveer said that line it sounded exactly like kapil dev! ️"
@TheSiddharthKothari,I saw this Movie Yesterday. The whole Theatre was re-living the moment. The movie was long but no one realised. Hats-off to the film-makers for such a marvelous film. This team of 1983 world cup taught India to win! A Must watch movie for all.
@DaniellaPark72,I'm not from India but i can say this movie is parallel to Bohemian Rhapsody. The way it was captured is just so on point and the cast did amazing job!
@aarav.129,"The look and accent, especially ( 𝙬𝙚 𝙝𝙚𝙧𝙚 𝙩𝙤 𝙬𝙞𝙣) and language Of ranveer Singh completely matches with the living legend Kapil Dev sir... And ranveer Singh has nailed it... "
@heysahilhere,The first win over West Indies and the world's dangerous baller they have never imagine that India has in the game of cricket after this win ! 🇮🇳️
@ravisharma709,"Ranveer proved himself again, salute to you man the glimpses of Kapil sir is clearly visible in you."
@nachikethp15,"The most underrated movie in Bollywood industry ig. I thought it was a flop movie which was said by all over the internet, when this movie got released. But today I watched the movie , it really brings tears in eyes. Hatsoff to the director nd Whole Indian cricket team including Kapil sir ️"
@bhavanimishra3807,Seriously...goose bumps.. eagerly waiting to feel those moments.. i was not born when India won the 83 world cup. As a die hard cricket fan waiting to see the magic on screen
@vishnusrivastava1652,When you know the story but still get convinced to watch the movie... That's the success of writer
@MindCapturer007,Any type of movies are safe in the hands of Ranvir. He lives the character beautifully.  Eagerly waiting
@user-yz8mf5uh7t,Thus man deserves a biopic. He has produced numerous single handed match winning batting bowling & felding performance the  biggest  cricket icon of india
@rishi.gupta27,"This is not a biopic of ""Kapil Dev"" it's a journey of those members who were rated as underdogs and they captured the World Cup "
@pattuwale7629,"As a Madras native, I say the filmmakers have captured Chika (Kris Srikkanth) with 100% accuracy. The twitch & sniffle, mad max batting technique, cigarette smoking, and most of all, the accent and attitude. Top class! Looks like a great movie!"
@altamashsayed5264,"The 83 victory will be celebrated once again in every house ,in every cinema and in everyone heart..
Huge respect"
@sunitakashyap819,Thanks to Netflix. What a movie literally felt like I was there *83* 
@pranjalmukherjee1142,Our first ever world cup trophy.No Indian can ever forget the fame our country have achieved .We were the underdogs during 1983 world cup.Salute to 1983 wc team playing xi of India
@rinky58,This guy Ranveer is crazy !!! What a transformation  Looks and body language just like Kapil Dev himself. This is going to be a super hit. And Deepika looks and act amazing!!!
@madcasmofficial,"The ""mazaak ki bhi hadd hoti hai"" line delivered by ranveer is the reason he is the king of acting in bollywood.."
@vickychawla1910,"When this match is played, I watch it on my black and white TV. My age is 11 years. A beautiful way was shown in this beautiful match."
@akashkhadka7798,"Trailer:10
Arijit song :10
Acting:10
Movie :10
Goosebumps:10000"
@essm4179,"Goosebumps every time Kapil says, ""I say before, we here to win!""  In true Kapil style, all action, no words! Love him, he is the best cricketer India ever produced."
@jatinmorwal1522,The casting has been amazing.... The scene where Chikka sir was talking about Kapil dev felt so real.....
@yonatanschlussel,"Just watched this and it's probably one of the best movies I've ever seen. The pride surging throughout the film for a country you're not even part of is unexplainable. The joy expressed through the movie of the Indians of the recognition they received upon winning the world cup is impossible not to feel. I never thought I'd have so much joy yet i did

Truly q masterpiece of a film that is not appreciated enough"
@pappagani,"I think Ranveer Singh did justice with the role. Hope the movie will bring back the memory of 83,i was just 6 years old then."
@fahadaman5401,"Goosebumps, tears, elevated heartbeats, heavy breathing, choked throat, shivers down the spine, knees trembling, swollen chest, head held high...what else is left to emote and love, respect, pride oozing out of my body by just watching the trailer. Its a national duty of all proud Indians to watch this movie. Proud of you guys!!!"
@FunnyBunnyVinesForYou,"Ranveer singhs acting is top class, he perfectly nailed the character of Kapil paaji. His voice, Expressions are top class"
@Saahil.m,This is one of the best Movie ever made in India.......
@nimishkumarsaini3292,Everyone saying that this is a flop movie but actually this is the perfect MASTERPIECE ️
@savithadevaraj2058,This movie will surely have 0 haters. Kapil....kapil this chants will fill the theaters. RESPECT +++
@dhavaldave1209,I've never been a fan of Ranvir Singh but i think this movie will change my perception for him. Looking at him in trailer and the way he acted looked much like Kapil Sir... Emotions are high... ️️️
@engadge,"Just 35 years after independence India was like an adolescent child who was just breaking out of puberty... India as a nation was poor, cutely innocent, underconfident and very humble... This win was the first spurt for this nation... And it looks like this country is not gonna look back now... Go India"
@srishtubaby,The trailer made me a little emotional. Imagine how our nation would have felt at that time. These are the movies which we crave for.
@amanw29,Literally had tears in my eyes watching this trailer. … Can’t imagine how special this 1983 World Cup would have meant for them
@AbhishekSharma-ty6vr,"This is sensational!! Even if a film on 2011 World Cup triumph is made, it won't be as emotive as this movie. 1983 win is very special in every Indian's heart"
@IPLHighlightsOfficial2020,83 and Miracle (2004) are truly masterpieces ️
@ronitdas1050,"Ranveer looks more Kapil Dev than Kapil Dev himself.. 
Salute to his dedication
U can make fun of his attire but when it comes to acting this man nails each and every character with his charm"
@AradhitaPyne,Winning this World Cup against everyone's hope was indeed a freedom struggle ... Hats off to the entire cast and crew of this film who have made this movie so special for us to watch...
@ambitious_abhii,"Excited to witness the past glory of India, when I was not even born...Hatts off to Kabir Khan for making this film."
@8Ranjitha,Watched this movie just now.loved it.In beginning my husband told he don't like Ranveer Singh so he will not watch but by sometime started watching and finished it.
@abhishekrangrej1481,In end of every bollywood trailer Arijit Singh song is mandatory ️
@yaseengani1,Was 8 years old and witnessed the  madness and celebration. 83 is not a movie but an emotion for people from that  era. I know by climax I would be in tears ️.
@survivorr3037,"He gets best scripts, the best character to portray, the best dialogues ( also got best girl )...and he nails it every time yaaaar...Kya ho tum Bhai....️"
@prasannavenkat7600,"What a masterpiece!!! Never watched any movie so many times like this one. Whenever I have been sad, watching this movie gives great confidence and hope. Thanks to Kapil Devils and the film makers"
@vasanthkrishna7809,"Apart from the emotional quotient of relating to this historical event as an Indian, got to admit Ranveer nailed it as the legendary Kapil Dev Ji. Salute to the Champions Team of 83 !!"
@JOJOPranksters-o6p,"1983 is not just a year,its an emotion for indians"
@muhammadnoman06,"Ranvir Singh just nailed Kapil Paaji's character, blockbuster trailer, the end is mesmerizing and emotional, goosebumps all over the body! Love from a Neighbour and a cricker lover <3"
@hmkw481,"Best Sports film of Indian cinema:- Lagaan, Chak de India, Iqbal, Paan Singh tomar, Bhaag Milkha Bhaag, Mary Kom, MS Dhoni, Dangal, Sultan & 83"
@nayanpatel1036,Goosebumps!!! when he said we got independence but still need to earn RESPECT!! This is now a theater quality movie to watch...can't wait!
@prachidubey4617,"O my god..... Ranveer singh looks phenomenal, his looks, his voice, his moves, his acting..... Everything on point"
@akbaraslam5349,Seriously The way Ranveer presented himself like Kapil is amazing…. It’s so difficult to match …
@somabiswas8650,Star Gold mein dekhte 2 nostalgic ho rahi hoon... Bohut achha laag rahi...
@MdHamimulKarim,"I am a Bangldeshi but still getting tears in my eyes after watching the trailer.
I am imagining how the Indians will feel after watching it.
Brilliant work."
-,35 साल पहले आज़ादी जीते लेकिन इज़्ज़त जीतना अभी बाक़ी है कप्तान :) वाह त्रिपाठी साहब जलवा और रणवीर भाई ने क्या एक्टिंग की है बिल्कुल कपिल देव साहब की याद दिला दी ️🇮🇳 Biggest Blockbuster of 2021 !!
@salsal278,"As a 9 year old in 1983  I still remember watching this match live at night at my neighbors place in Mumbai. While the Windies were batting, the lights went out for a while  but were back later. Me and my brother celebrated as we heard fire crackers light up all over Mumbai."
@moveitstime,"I watched on #Netflix. This is a true inspiration to cricket generations and fans. 
BCCI was not so rich those days, but our players did their die-hard efforts to lift the glory!!!"
@DeadlyRiderz,Finally amazing movie is coming after MS DHONI ️
@Lucifer-pq7uy,"This has  to be a masterpiece.... Many(this generation) haven't experienced the win in 1983 world cup , So this is going to be the highest grossing movie of the year, Thank You Kapil Dev Sir"
@vasuarora4841,my god... Goosebumps... and Ranveer's Character as Kapil Dev is Top Notch...
@tanishkarpe9386,"Only goosebumps while watching this movie 
Really love this movie, feel sad that it's underrated  but mind blowing performance by ranveer singh"
