Username,Comment
@explorervikky,Ranveer Singh never disappoints with his hard work.. He is one of superb actor in bollywood..
@nikunj_films,"so nobody gonna talk about, at 3:11 how beautifully they showed real cricketers names instead of actors names, this shows the respect for the real heroz of 83, even the movie name is not kapil dev, it's 83 "
@samratamitsingh786,Masterpiece  Because of this team 83  India 🇮🇳is now Cricket  Power House of world ️ Goosebumps  Ranveer versatility level- Infinity 
@prettyamrita4909,"Because of ranveer singh i was avoiding to watch this movie .

But i can say after watching this movie 
I just felt  nd want to admit 
I should not prejudiced before watching any movie

This is awosome movie

Real sport movie 
I just love it 

My mummy is very crazy about cricket i m used to watch cricket match with my mom during my school time

 Salute to team of  83 . Awosome movie. Awosome making .

No love song no faltu ka emotional family drama  nd deshbhakti ka overdose.
  just about 83  nd sport spirit.. everything is accurate nd in right amount 
Not less not  more

For me emotional part when  real  Kapil Dev  catched   ball. I just cried nd cried

Sorry for my prejudiced thinking before watching this  movie 

️️️️"
@englishwithmukeshsingh268,"This is insane
What a job Ranveer Singh has done man...
This is crazy
Finally after Bhag milkha bhag  and M.S. Dhoni ,here comes another epic movie"
@thecinemaniacs6197,"The way Ranveer Singh has managed to transform into Kapil Dev is simply magic. If nothing else, his performance will be a template for other actors on how biopics must be done. 
Kudos to Kabir Khan and the casting team for bringing together so many actors, from different backgrounds, and merging them seamlessly into the 1983 Indian Playing XI."
@ftronkypom8852,"Am I the only one who wasn't there in 83 but watching this trailer had Tears with Goosebumps , We Bleed blue 🇮🇳🇮🇳🇮🇳"
@prakashvalsangkar4783,Filmfare best actor award goes to Ranveer Singh for this movie.
@naveenn805,"Most of us didn't know how it felt to  be won our first ever world cup then, but we will surely feel it in the cinema hall.."
@prakhart92,"He excellently copied Legend's way of speaking and face expressions. 
This man is intense.
Love you Ranveer."
@hiteshdahate3843,"Rarely get tears watching trailer, this is when we arrived as a cricket crazy nation, when we were not born but have heard alot about. 
Ranveer and rest of the cast, resemble the team so well, loved it.
Kabir Khan, hats off."
@suvoranjanbanerjee4808,"After more than 1 years of watching the film, that dialogue ""we're here for win"" still gives the same goosebumps.
Arguably 83 is the best Indian movie about cricket (from a fan boy MSD).."
@akshaytrivedi6155,"His smile , looks , voice everything is exactly like kapil dev... Ranveer Singh you are tooo good maan what a actor .. always surprise with his acting skills"
@22copefilms,The only film in which ranveer and deepika's characters not gonna die in the end ️
@bhumika9935,This is going to be a masterpiece and I can confirm this. Ranveer's acting is literally everything>>>>> no one can ever come to his level️
@umashankar400,Forget about people review. According to me this is Awesome and Great Movie of All-time 
@girishchaudhary5110,This is not a movie. it's emotions. Every cricket fans are involved . What a trailer ️
@indranilDey227,Only one word it’s a “Goosebump”. This would be a legendary movie of this era for sure......!! #Amazing83
@robinsaxena4465,The amount of goosebumps I felt in this trailer is much beyond the amount I had in this entire year !!!  #83
@DHarshini-dd1bp,Every Indian needs to watch this
@manavshah7033,"Ranveer Singh just broke the stereotype of him being a funky and cool hero.
This is lit..  a blockbuster"
-,Kapil Paaji Zindabaad
@kuldeepbrahmbhatt,83% of Indians alive today haven't lived these enchanting moments... I thought this movie to be a risky project ... And more than that the patient of producers holding the launch for almost 18 months... Most of the punches are covered in the trailer but I believe there is more to experience ...  Bring it on.. can't wait anymore
@samirkar7031,"I m in class eight in that time , so we are the witness of that moment, so when I watch this movie, I recall my student time. Nice creation"
@anuragpanda1999,"Finally a movie after ""Chak De! India"", where every kind of emotions are guaranteed "
@sachinanand3532,"We Indians can give emotional touch to any and everything. And, when it's about cricket we bleed blue"
@faustinepimento298,"By far the greatest victory India has ever tasted..... Man, defeating a team who were deemed lethal and unstoppable in the 80s such as the West Indies in a foreign pitch was nothing short of amazing 🇮🇳"
@mehedihassan-vb1rn,Kapil dev is a legend & one more thing he always Focus genuine cricket play not win like fake fielding....   🫡
@saurabhchalke,It's always great when the trailer doesn't give away the entire movie.
@leviaot-m1u,The trailer made me very emotional . Imagine how our nation would have felt at that time. These are the movies which we crave for
@jp1966a,I had watched the entire 83 final match as a young kid late into the night and still remember the excitement and thrill when we won the match.  This trailer made me relive those memories...waiting eagerly for the movie to release and watch it.
@mandeepkumar1746,Dil me aisi touching kra hai ki sb kuch es movie me real dekha hai...love u 83 players
@abhijith501,"the vibes of this movie are giving goosebumps. 
Ranveer has gone into the skin of the character and thanks a lot Indian team and Kapil paaji for the first ever world cup in 1983.
 Heard a lot about world cup now will be witnessing this master piece."
@Whatreally123,Ranveer is undoubtedly the most talented and intelligent actor of the current generation. No one comes close.
@Poorwashree,His Look and his acting..hats off!! Ranveer is slaying it again!
@jyotikhandagale8493,I saw this movie today ..Every Indian should watch this and celebrate the success..... ️️️ Inspiring Journey ️️️
@1nterlnked,"When Pankaj Tripathi said,""35 saal pehle Humlog azaadi jeete, izzat jeetna abhi baaki hai kaptaan""... Goosebumps "
@bituponborah4215,I wasn't even born when India achieved this historic feat .This movie is going to give us the opportunity to relive that moment of winning the 83 World Cup.
@prathamsalvi7328,I really got goosebumps after watching this trailer proud to be a indian proud to be a indian cricket fan 
@NaveenKumar-yn5dk,Ranveer Singh has lived in the role of Kapil Dev. While watching the film ai felt Kapil was playing alongside the actors in the film.
@darpanrelankiduniya4574,"We can't imagine the joy of that time winning the world cup in 1983 but this movie will give us a real feeling for that moment can't wait for this 
Goosebumps"
@shoaibali-xy7rg,Ranveer singh has completely justify the role and the movie is promising the other casts also looking promising just can't wait to experience this movie on big screen
@nayeembaig7901,"This movie in a local theatre. The vibes, the goosebumps, the whistles."
@cw5733,Much deserved Respect  to India.  As a South African still at school we never saw this Historic game.  The cricketers  deserved the world cup.  Absolutely  fabulous   
@kishorekhot,"This World Cup changed the mindset of my generation of Indians that we could win at the international level
Inspirational win Goosebumps Looking forward to the movie"
@king_chokra8896,"This is absolutely brilliant portraiture of 83 World cups. Viv Richards , Clive llyod were literally superstars"
@Lambor_Gaming,Fun fact anyone notice the movie name is 83 and views are 83 milllion
@FearlessStar33,This got tears in my eyes and my heart was full in the end. Each and every actor has molded themselves into the role so well. THIS IS GOING TO BE A HUGE BLOCKBUSTER FILM FOR 2021. RANVEER SINGH nailed it.
@thecorporatelabour,"A true Cricketer can feel the vibe of the movie... Goosebumps, teary eyes, huh!!!!... The feeling is insane ... 
India India... "
@XavierMemeWorld,That West-Indies team was unbeatable but our boys did it.
@neelusharma6295,Thankx reliance..m nt born in 1983..but I shw my father's favourite hero of cricketer mr kapil dev ji
@somadey775,Ranveer Singh is a gem of Indian cinema . His acting level is on another level . It actually proves that real talent is beyond nepotism .
@WatchNow24_7,"I got goosebumps  what a trailer it is! Cricket  unites everyone. All the very best to Kabir Khan, Deepika,Ranveer, Hardy and Amy virk. This is a blockbuster."
@piece_of_peace.,"There’s a feel that the crowd would rejoice once again, at the end of this movie"
@sauravkumar-tc8ln,The trailer made me very emotional . Imagine how our nation would have felt at that time. These are the movies which we crave for
@riya.choudharyy18,What a masterpiece so glad to be part of it.....
@vhanusingh7359,"After dis film, RANVEER SINGH will remember for his Performance for CENTURIES ...!!!! A MOVIE IS A PERFECT TRIBUTE for KAPIL DEV'S HARDWORK AND DEDICATION."
@mr_sidharth,"I wasn't born to watch the 83rd World Cup but to be a witness of this, I'll definitely watch it in the theater. 🇮🇳"
@imtiyazkhan-tts,"We indians are much more emotionally attached to our country than rest of the world
Proud to be indian"
@trudyeastland4036,This is one of the best I have watched.  Congratulations India on your win in 1883... I will watch this over and over.  One of my friends from India told me to watch it. It's AWESOME.  Everyone was fantastic in this movie.  I love it.  I am from America and I love India 🇮🇳 ️
@TheVibesOf,"I literally had tears rolling down my cheeks while watching this trailer! As a late 90s Indian kid I had only the chances of reading about this extravaganza of event, as we grew into the days of internet I had the chance of atleast watching few highlights of the tournament and the hurdles the team had faced but I guess with this film, I get the chance to live the moment which I can't give up on! Eagerly waiting to experience it only in cinemas with the fellow Indians!"
@honeydudeify,My papa was 15 years old in 1983 and watching this in theatre with him  is something I'm looking forward to 
@darshanamalap4775,What a movie yaar... Masterpiece... People were clapping in theaters like enjoying real 83 world Cup match
@limitlessfunnyvideos8441,Actually kabir khan is best director he made really all best movies bajrangi bhaijaan phantom tubelight 83 new york alll
@Sinu_14,"This trailer brings smile, joy on my face,  tears in my eyes.... Feeling proud to be an Indian.... 

Thank you Kapil Paji.. "
-,"Amazing Trailer 
Ranveer Singh's Acting ️
Arijit Singh's Voice 2:46 Second ️"
@rajnish1990,It's not only film it's emotion for all Indians 🇮🇳
@MuskanKhan-bx6nb,"Kapil paa ji born leader, but he didn’t known this unless unity of the team , I must applause for the all the team how they stood with him n worked together, UNITY IN DIVERSITY MADE IT. Incredible INDIA"
@devagrawal9647,"Don't lie to yourself.
You definitely got gossebumps and the part where we witnessed sachin and that legendary press conference.
Excited for the movie"
@mayanksolanki8515,Wow is not just a movie this is the  emotion off million's people.. Jay hind..🇮🇳🇮🇳️
@alokshrimal9799,"Goosebumps trailer.. what a expression, accent and dialogue delivery of Ranveer singh...there is nothing in this world he can't do..good space for other actors too..this movie going to be next big in Bollywood history...Hats of the story telling.. some dialogue are insane like ""Ajadi to 35 saal phle mil gyi lekin Ijjat milna abhi baki h"" and ""Jeetne aaye h"""
@bbgaming99,its not aw history its  emotion of every indian ️
@sreeragm.s4323,"As a cricket fanatic, I've always wanted to see a film about our country's greatest sporting triumph. As a millennial, I'd like to think that after watching this film, I'll have a better understanding of the tournament."
@AkRocksworld,"Sandip Patil was the unsung hero of this world cup, he played a magical inning in the semi final against England, and also contributed well in the finals.."
@chandanpandey2446,"This movie is so close to every Indian's heart, blockbuster performance by actors and great casting"
@juepaul691,83 Is forever !!! Other movies will come and go 
@monushree391,Ranveer has played super performance. Best movie ever seen.
@soumitraghosh6406,Did anyone notice junior Sachin Tendulkar on his elder brother's shoulder? Goosebumps!!! 
@dipjoy_sen06,You may troll Ranveer Singh for being joker at times..but on screen he always tries to give his best..Gully boy..Ram.. Lootera.. Bajirao.. Khilji..and now Kapil Dev..
@ravikumarsukruthigs5893,"The man who stood up against all odds and spearheaded the team towards Victory.. Kapil Dev, a true indian by heart and soul , deserves Bharat Ratna for his incredible and impeccable service to the nation in the form of Cricket..The first superstar of Indian cricket by any standard who orchestrated Indian cricket into the current position..Hats off Man...U r true God of the cricket !!"
@ujwall1244,That's what ranveer is praised for.... What a trailer
@Sumit-b1,"""""“Never give up. Today is hard tomorrow will be worse. But the day after tomorrow will be sunshine.”"""
-,"Had been waiting for this masterpiece ever since it's announcement! Just no words for the trailer.. It's goosebump inducing. What a treat! ️
#83 #IndiaJeetega 🇮🇳"
@oldman2910,I am yet to understand why people disliked this film or Ranveer’s acting. It was top class
@Abi-el8uq,"Deepika absolutely lights up every scene she's in, you can tell she was born for the screen! I miss her movies so much!! I can't even tell it's Ranveer, he has become Kapil Dev!"
@Voice4ubro,"Ranveer just  wow, his acting, his energy, he is the one and only star in bollywood who can perform each character alive.."
@manmayakumarsahoo7330,"Watched and lived every moment of 2007 t20 wc,  2011 wc and 2013 champions trophy. 
Now will get to feel how it must've felt to win the WC in 1983."
@preetidutta4375,I was eagerly waiting for this kind of movie. Thanks to Kabir Khan sir for this wonderful movie. India me cricket ko cricket ka darja dilane k liye Kapil sir or unki team ne jo mehnat ki hai use Aaj ki generation is movie ke through samjh payegi 
@ritugupta4920,"FROM BAJIRAO TO KHILJI TO KAPIL DEV,YOU KNOW THERE IS ONLY ONE MAN WHO CAN DO SO MUCH DIFFERENT ROLES,RANVEER SINGH."
@gayatrijadhav4605,"Such an legendary movie.. 
Acting of every  character is really appreciating.. 
Like, I was shocked when I saw ranveer singh, I swear , He is totally looking like kapil dev.. 
This movie proves that Bollywood is still Bollywood and we produce actual masterpieces.."
@Talk_logical,"tears in my eyes and goosebumps to see the emotions, the victory which created history for India 🇮🇳 and the Indians across world. Love from Canada 🇨🇦"
@bhaderwahi.gupshap5026,No one can match the level of acting  ranveer singh 
@linajoardar,I was a little kid when this historic event took place. Still remember how my dad and uncles danced and jumped around with joy ! Thanks to the entire team for working so hard and presenting this. We are all waiting for this film to release and hope it’s a huge success. My best wishes from USA 🇺🇸 to India 🇮🇳
@arunb2662,"This happened 16 years before I born . I remember how I felt when I read this in a cricket magazine.
Still I have goosebumps by just watching the trailer.
Eagerly waiting for the movie️️️"
@rutujasalunkhe7610,I had very low expectations from this movie... But surprisingly this turned out to be must watch movie... It's a overwhelming experience to watch this movie...
@protubershrish6765,Just watched the movie — such a class movie — we should encourage such movie —- oh gosh real hero’s — started crying when Kapil Dev breaks the record and he is unaware of it 
@learner441,"I hadn't thought that I'll cry watching this trailor
This shows why cricket is breath of India 
Cricket helped India establish it's powerful existence in world!! 
Now let's not forget its legacy and focus on other sports similarly "
@jerinarnold5232,Watched the movie yesterday and I couldn't help comment somewhere about the movie.. What a movie!! Well directed and astonishing acting by all...one can see Kapil Dev and the Indian team on screen..not Ranveer and a bunch of actors...!! A must watch movie... !
@rosequartz8524,"Ranveer killed it! He is unrecognisable.
Deepika-Ranveer together always create some magic. ️
Pankaj Tripathi adding more magic.
Each and every character killed it. Superb acting."
@CHILL_IN153,No one slept that night when the indian team realised it was time to eat no shops were open they slept with a empty stomach but with a full heart proud to be indianINDIA ZINDABAAL
@unimaginable.,For Indian cricket fans this Victory not only a Victory of 11players its a victory of millions of INDIANS and their dreams 
@definitelynot_0798,"This isn't just a masterpiece! 
This will be ONE OF The GREATEST MOVIE OF ALL TIME  
Just wishing this new Omicron variant won't let us down again!!!!!!!!!"
@ketan8421,"The way Ranveer talked if u listen closing ur eyes; u would definitely feel that its great Kapil Dev’s voice… 
Waiting badly to see on big screen  thanks Kabir Khan "
@sodhamanansinh8865,35 saal pehle hum log aazadi jeete hain lekin izzat jeetna abhi baaki hai kaptan purely goosebumps 
@sanchitswlkr,"I really hope, that this time a director does justice to one of the most important events in Indian sports history by sticking to the original material and not by relying on synthetic Bollywood drama and punchy colors. The cast's transformation in their respective roles does appear to be honest and convincingly well thought out in the first glance. Happy to see that the trailer actually released."
@khannaboys,Born in 83 and just just just can stop tears to bless those heros. . . Specially Kapil Sir. Great Man. Thank you paaji. God Bless you.
@shubhamkamboj7271,This movie is going to be great for Cricket fans ️
@offx_adhyy,Me After India Won The World Cup🥹🩷
@damuunnikrishnan,3:00 - The day that inspired a kid to be the God of Cricket.
@itsmevickey2631,"Ranveer singh is proved that to he is real character for Bollywood 
He plays many role but this was the kapil dev role is one of my fav .  
So cheer up guys #83️"
@dr.ajitpatnaik8823,I congratulate Ranveer Singh for being part of this masterpiece and living up to the character.
@aryanpatel7353,"Very realistic depiction of 83 worldcup 
Very nice work done
Such type of movies should be made "
@bikhyatsikha8884,I think ranveer doing so much hard work mor this film  and all other actors too. All the best team 83 ️
@study_network1,"“Play Life like a Cricket match. Don’t try to hit hard in every situation, Just keep rotating, moving, and then look for that one Delivery and hit it as hard as you can.” 🇮🇳"
@Nobody1991,"When it comes to acting, Ranveer Singh is pure professional. "
@AnuJain000,Aaj history repeat hogi aaj phir India trophy  uthayega
@J.k.republic,I am born in 2000 but after watching the trailer can feel the same passion of 1983 ️️️
@tmuthupalaniappan,Time Stamp: 3:00 - That's Sachin for you :)This trailer is just wow & Ranveer nailed it.
@crkofficial9083,This is the kind of Movies that we need to understand and learn from our history. Ranveer singh’s reply about srikanth’s batting during net practice was an epic reply and he did Justice to his character!! Salaam
@ThePathseeker,"This movie is a heavily underrated masterpiece..the making, the performances and the accuracy of the sport actions are all unparalleled in Indian cinema and upto world class mark...... Ranveer Singh had his greatest performance too"
@dhruv1507,"""We here to win"", this line feels like Kapil Dev himself is saying that"
@amritraj3898,"huge fan of Arijit ️but, I can't able to recognise his voice while watching this trailer for first time.....totaly lost in this trailer ️...it gives goosebumps, emotion, patriotic feelings ️️"
@marvinbhuminpatel4405,"Just Wooow!!!!!!! No words for the casting, acting, makeup, story! Hats off!! ️"
@exploringmysteries22,Still Goosebumps after watching the film!!! 
-,मेकप  आर्टिस्ट  ने  तो  हमारे  रणवीर  सिंग  को  ही  पूरा  कपिल  देव  ही  बना  डाला 
@MK-pw9ke,"At 2.08 - ""ek match tho jeet k jao "" 
Gives goosebumps nd tears at the same tym !!!

This movie gonna be masterpiece by ranveer singh ️"
@veenakaur644,It look funny and emotional at the same time I need this type of movie in Bollywood I'm really excited to see this and this movie definitely gonna break the record ️
@hmkw481,"83 is the best film of Ranveer Singh's career...
️"
@Vor567tez,"Really love how at the end it shows actual players name. Hope the movie will be more about sports and not fall into typically  bollywood masala biopic with the opponent team as clichés villain. 
Also the make-up, set, costume designer deserves an award. The way they tried to make every actor as close as real life cricketers is just mind blowing. Even the West Indies side looks amazing."
-,Voww after so many days any movie is giving GOOSEBUMPS 
@binitapaul6302,The team.. The energy.. We owe a lot to it.. It's gonna be the blockbuster of the year.. Hats off to the cast and crew ️
@Iam_raju_ch,To me this movie 83 and this World Cup win stands above all the other  world cup victories for India. Sadly people failed to connect to it.
-,Wow Brilliant Trailer Sure Will Create New History 🇮🇳 🇮🇳 Jai Hind  India Jindabad
@sudhanshubhardwaj9824,This is going to break the records of all the biopics made in Bollywood 
@shrisridhar2020,"First time in history getting tears by watching trailer....
Everyone should respect 83 Indian cricket team.
It is emotional movement for all Indian, they ruled here more than century killed lot of peoples.
Maybe it is game but first time our National flag hosted in England after winning the game.
History made. ️"
-,"Goosebumps, this should have been a massive hit. its not the movie which was disappointing, its the audience."
@manmohansingh1956,A miracle of movie! Just unbelievable! Chak te fatte! ਚਕ ਤੇ ਫੱਟੇ! 
@rahulk6266,The versatile actor is back with his versatility performance 
@kalaivanibaskar661,"Incredible acting!! Finally after 2-3 years, this team's hardwork can be seen and appreciated by everyone"
@DeepakSingh-wm8ol,Ranveer Singh is here to prove again that he is just here to win what an incredible actore
@sanchigupta6738,"You can troll Ranveer Singh for his dressing sense, but when it comes to acting, he is the best that we have."
@kashif123badshah1,Goosebumps...filled with tears in the eyes... it seems team 83 is now on the ground specially the gestures and dialogue of ranveer as kapil... great casting results in great team.. love my 🇮🇳..
@AzadHind572,The BGM of this movie is at next level. And the acting of ranveer Singh is just undescribable. He's damn talented guy. He needs more recognition for sure
@MhmedySizya,"What I think ranveer doesn't deserve to win any award I think DHON the untold story is best than this no comper bro

Rest in peace bro susant sing rajput may God bless you"
@chanduilla4300,Tears rolled.. can't able to wait for movie.. Goosebumps while watching the trailer
-,"GOOSBUMPS already! 
India 🇮🇳 India 🇮🇳 India 🇮🇳"
@AkashShah24,"Guys, let's do one thing
Let's give justice to our first victory of World Cup by not pirating this movie and rather going to theatres to watch this live and relive the goosebumps of '83 with our family and friends. "
@ramkumarr1725,Never believed in 83 innings till this movie. Sirf Ghar bhaite satyug dekh rahe hain. Love. Trinity and Neo.
@jahangirkhanniazi2042,So much respect for 1983 captain and team India and for this movie best of luck all production ! Love from Karachi
@priyankapariyar1502,"3:00 i cried at this point..
A game that united the whole country.."
@simransazdaalkabir,This is going to be a masterpiece and I can confirm this. Ranveer's acting is literally everything>>>>> no one can ever come to his level️
@AnkurKumar-fj6oq,Ranveer singh is very good actor.......
@tacog909,"The boy in curly hair celebrating over shoulders that moment, who knew this  adorable kid will take game to new heights later... Goosebumps!!"
@roshankumar-pp9nj,When cricket was not for brands or advertising commercials. World cup then was purer and original. Earned with battle hardened love for country only by one and only team of the world. Kapil's and his only eleven. Not just an Indian team by any standards. It was the rest of the world against Kapil's eleven.
@TruthOnly142,The Best Part is when they introduce the Characters at the end by their actual Batting Order.
@salmanhussain4986,I’m pakistani 🇵🇰 but this film gives me goosebumps  that song Jeetega Jeetega is just something else ️
@vrushankdhuri4058,"Finally, something to watch with my Father in the theaters that we both discussed from my childhood.. Not sure about theatre experience, but trailer is goosebumps..."
@prakhart92,Once again Arijit killing with his voice. So excited to hear it out.
@LuvDhun,"Hai Dua Har Dil Ki Hai Yakeen Lakhon Ka India Jeete Ga
Arijit Singh goosebumps️"
@bluemoonbm3618,"MASTERPIECE Film thi, Just rewatched it on Netflix after the theatrical release, still can't digest that it was a flop movie"
-,We can’t wait 
@sanjeev6987,"""35 saal pehle hum aazadi jeete, magar izzat jeetna abhi baaki hai"" sums up the emotion and significance of 83 win."
